{
  "bots": [
    {
      "active": 1,
      "assignments": [
        {
          "bot_id": "bot_main",
          "created_at": "2026-10-09T10:19:02.312Z",
          "finished_at": null,
          "from": {
            "kind": "user"
          },
          "id": "asg_1",
          "instruction": "做事",
          "model": "prv_mock/mock-model",
          "origin_chat_id": "chat_login",
          "parent_assignment_id": null,
          "pending_messages": 0,
          "project_id": "prj_login",
          "queue_reason": null,
          "result_message_id": null,
          "started_at": "2026-10-09T10:19:02.312Z",
          "status": "working",
          "steers": [],
          "subagents_active": 0,
          "title": "任务",
          "trigger_message_id": null,
          "usage": {
            "cache_read_tokens": 0,
            "cache_write_tokens": 0,
            "cost": null,
            "input_tokens": 10,
            "output_tokens": 20,
            "requests": 1
          },
          "wait": null
        }
      ],
      "bot_id": "bot_main",
      "max_parallel": 2
    }
  ],
  "done_today": [],
  "global_limit": 4,
  "running": 1,
  "subagents_running": 0,
  "waiting": []
}
